{
  "id": "inc-20260623-001",
  "service": "checkout-api",
  "environment": "prod",
  "severity": "HIGH",
  "status": "READY_FOR_ANALYSIS",
  "triggerType": "P95_LATENCY_SPIKE",
  "startTime": "2026-06-23T12:03:00Z",
  "peakTime": "2026-06-23T12:07:30Z",
  "endTime": "2026-06-23T12:13:00Z",
  "summary": "p95 latency increased while payment provider calls timed out.",
  "evidenceWindow": {
    "from": "2026-06-23T11:58:00Z",
    "to": "2026-06-23T12:18:00Z"
  }
}
